{
  "schemaVersion": "1.0",
  "themeId": "survivor_horde_golden_demo",
  "locales": ["zh-CN", "en"],
  "defaultLocale": "zh-CN",
  "levelMeta": {
    "title": {
      "zh-CN": "荒域生存试炼",
      "en": "Wasteland Survival Trial"
    },
    "intro": {
      "zh-CN": "在限时内移动、自动攻击并收集升级，击败或撑过敌潮。",
      "en": "Move, auto-attack, collect upgrades, and survive the horde."
    },
    "objectiveText": {
      "zh-CN": "存活至倒计时结束或击败首领",
      "en": "Survive until the timer ends or defeat the boss"
    },
    "controlHints": {
      "zh-CN": "移动：指针/WASD · 攻击：自动",
      "en": "Move: pointer/WASD · Attack: auto"
    },
    "hudLabels": {
      "zh-CN": "生命|时间|击杀|灵魂",
      "en": "HP|Time|Kills|Souls"
    },
    "victoryText": {
      "zh-CN": "试炼通过",
      "en": "Trial cleared"
    },
    "failureText": {
      "zh-CN": "试炼失败",
      "en": "Trial failed"
    },
    "retreatText": {
      "zh-CN": "已撤退",
      "en": "Retreated"
    }
  },
  "entities": {
    "player": {
      "zh-CN": "试炼者",
      "en": "Challenger"
    },
    "enemies": {
      "mob": { "zh-CN": "荒原奔兽", "en": "Wasteland Beast" },
      "elite": { "zh-CN": "鳞翼猎手", "en": "Scalewing Hunter" }
    },
    "bosses": {
      "boss": { "zh-CN": "兽潮首领", "en": "Horde Chieftain" }
    },
    "pickups": {
      "soul": { "zh-CN": "魂火", "en": "Soul Ember" }
    },
    "skills": {
      "auto_bolt": { "zh-CN": "自动弹道", "en": "Auto Bolt" }
    },
    "statuses": {
      "level_up": { "zh-CN": "晋级", "en": "Level Up" }
    }
  },
  "copyKeys": {
    "taunts": {
      "zh-CN": "兽潮逼近！",
      "en": "The horde approaches!"
    }
  }
}
