{
  "schemaVersion": "1.0",
  "themeId": "rhythm_timing_neon_pulse",
  "locales": ["zh-CN", "en"],
  "defaultLocale": "zh-CN",
  "levelMeta": {
    "title": {
      "zh-CN": "霓虹节拍关",
      "en": "Neon Beat Gate"
    },
    "intro": {
      "zh-CN": "跟上脉冲节拍，点亮数据环。",
      "en": "Hit the pulse beat and light the data rings."
    },
    "objectiveText": {
      "zh-CN": "累计节拍进度达标",
      "en": "Reach beat progress target"
    },
    "controlHints": {
      "zh-CN": "点按脉冲环 · 错过掉盾",
      "en": "Tap pulse rings · Miss drains shield"
    },
    "hudLabels": {
      "zh-CN": "护盾|时限|节拍|连击",
      "en": "Shield|Time|Beats|Combo"
    },
    "victoryText": {
      "zh-CN": "节拍同步完成",
      "en": "Pulse locked"
    },
    "failureText": {
      "zh-CN": "信号失锁",
      "en": "Signal lost"
    },
    "retreatText": {
      "zh-CN": "已断开链路",
      "en": "Link dropped"
    }
  },
  "entities": {
    "player": {
      "zh-CN": "脉冲操作员",
      "en": "Pulse Operator"
    },
    "enemies": {
      "orb": { "zh-CN": "数据脉冲环", "en": "Data Pulse Ring" }
    },
    "bosses": {
      "boss": { "zh-CN": "核心干扰体", "en": "Core Jammer" }
    },
    "pickups": {
      "combo": { "zh-CN": "同步火花", "en": "Sync Spark" }
    },
    "skills": {
      "perfect_hit": { "zh-CN": "完美同步", "en": "Perfect Sync" }
    },
    "statuses": {
      "focus": { "zh-CN": "锁定", "en": "Locked-in" }
    }
  },
  "copyKeys": {
    "boss_banner": {
      "zh-CN": "干扰体出现！点破节点，点按护盾反弹！",
      "en": "Jammer online! Break nodes, tap shields to counter!"
    },
    "weak_point": {
      "zh-CN": "节点",
      "en": "Node"
    },
    "defend": {
      "zh-CN": "护盾点按",
      "en": "Shield tap"
    },
    "laser_charge": {
      "zh-CN": "扫射充能！点节点打断！",
      "en": "Sweep charging! Tap nodes!"
    },
    "laser_fire": {
      "zh-CN": "脉冲扫射！",
      "en": "Pulse sweep!"
    },
    "interrupt_ok": {
      "zh-CN": "充能打断！",
      "en": "Charge broken!"
    },
    "defend_ok": {
      "zh-CN": "反弹成功",
      "en": "Countered"
    }
  }
}
